{
  "id": "RCPT-508d3c76",
  "createdAt": "2026-03-08T10:25:54Z",
  "kind": "llm-call",
  "provider": "gemini-direct",
  "model": "google/gemini-3-pro-preview",
  "latencyMs": 5744,
  "tokensIn": 256,
  "tokensOut": 41,
  "status": "OK",
  "error": "",
  "metadata": {
    "purpose": "ai-irb-panel",
    "warmup": true
  }
}
