{
  "id": "RCPT-e1a49ebf",
  "createdAt": "2026-03-16T00:54:34Z",
  "kind": "llm-call",
  "provider": "openrouter",
  "model": "openai/gpt-5.2",
  "latencyMs": 262,
  "tokensIn": 242,
  "tokensOut": 46,
  "status": "OK",
  "error": "",
  "metadata": {
    "purpose": "ai-irb-panel",
    "warmup": true
  }
}
