{
  "id": "RCPT-373155d6",
  "createdAt": "2026-02-28T18:20:09Z",
  "kind": "llm-call",
  "provider": "openrouter",
  "model": "x-ai/grok-4.1-fast",
  "latencyMs": 377,
  "tokensIn": 384,
  "tokensOut": 300,
  "status": "OK",
  "error": "",
  "metadata": {
    "purpose": "ai-irb-panel",
    "warmup": true
  }
}
