{
  "id": "RCPT-8a15d4aa",
  "createdAt": "2026-02-24T02:27:19Z",
  "kind": "llm-call",
  "provider": "openrouter",
  "model": "google/gemini-3-pro-preview",
  "latencyMs": 2987,
  "tokensIn": 138,
  "tokensOut": 1714,
  "status": "OK",
  "error": "",
  "metadata": {
    "purpose": "ai-irb-panel"
  }
}
