{
  "id": "RCPT-b9966947",
  "createdAt": "2026-02-16T13:20:09Z",
  "kind": "llm-call",
  "provider": "openrouter",
  "model": "openai/gpt-5.2",
  "latencyMs": 443,
  "tokensIn": 0,
  "tokensOut": 0,
  "status": "ERROR",
  "error": "http=402 body={\"error\":{\"message\":\"This request requires more credits, or fewer max_tokens. You requested up to 900 tokens, but can only afford 792. To increase, visit https://openrouter.ai/settings/credits and upgrade to a paid account\",\"code\":402,\"metadata\":{\"provider_name\":null}},\"user_id\":\"user_39gEuVtKiLyfbF0ZZGuJhJyyHlh\"}",
  "metadata": {
    "purpose": "ai-irb-panel"
  }
}
